{
  "schema_version": "1.0",
  "case_id": "CASE-S1-001",
  "project_id": "S1-DEMO",
  "model_id": "S1-bSDD-example",
  "model_version": "4075c44a6e47",
  "task_id": "TASK-S1-001",
  "zone_id": "ZONE-S1-L05-EDGE",
  "as_of": "2026-10-16T09:00:00+08:00",
  "title": "L05板边安全检查演示",
  "status": "draft",
  "bim_guids": [
    "0FOHK4aT910wgskSbVHn0U"
  ],
  "evidence_ids": [
    "EV-001"
  ],
  "rule_ids": [
    "GB-3.2.1",
    "GB-3.2.3",
    "JGJ-4.3.1"
  ],
  "findings": [],
  "controls": [],
  "review": null,
  "verification": null,
  "versions": {
    "case": 1,
    "rules": "v1"
  },
  "assumptions": [
    "板边已在演示中标注为需检查边界，不等于真实项目临空侧",
    "坠落高度2.5m、人员作业和防护缺失均为模拟观察"
  ],
  "provenance": "mixed_real_bim_simulated_site_state",
  "mode": "demo"
}
